{
  "schemaVersion": 1,
  "catalog": "BRASA Global Learning Network",
  "status": "curated-discovery",
  "updatedAt": "2026-09-11",
  "disclaimer": "Independent providers own their courses, access rules, credentials, availability, and learner accounts. Listing is not a partnership, endorsement, accreditation, or employment guarantee.",
  "providers": [
    { "id": "ibm-skillsbuild", "name": "IBM SkillsBuild", "owner": "IBM", "url": "https://skillsbuild.org/", "access": "registration", "cost": "free", "languages": ["multiple"], "formats": ["online", "self-paced"], "offline": "unknown", "credentials": ["digital credential", "certificate"], "skills": ["artificial intelligence", "cybersecurity", "data", "workplace skills"], "careers": ["technology", "business operations"], "geography": "global", "review": { "status": "reviewed", "reviewedAt": "2026-09-11", "nextReviewAt": "2026-12-10" } },
    { "id": "google-skillshop", "name": "Google Skillshop", "owner": "Google", "url": "https://skillshop.withgoogle.com/", "access": "registration", "cost": "free", "languages": ["multiple"], "formats": ["online", "self-paced"], "offline": "unknown", "credentials": ["provider certification"], "skills": ["advertising", "analytics", "marketing", "business tools"], "careers": ["marketing", "sales operations", "small business"], "geography": "global", "review": { "status": "reviewed", "reviewedAt": "2026-09-11", "nextReviewAt": "2026-12-10" } },
    { "id": "aws-skill-builder", "name": "AWS Skill Builder", "owner": "Amazon Web Services", "url": "https://skillbuilder.aws/", "access": "registration", "cost": "free-and-paid", "languages": ["multiple"], "formats": ["online", "self-paced", "lab"], "offline": "unknown", "credentials": ["digital badge", "professional certification pathway"], "skills": ["cloud", "artificial intelligence", "security", "data"], "careers": ["cloud operations", "software development", "cybersecurity"], "geography": "global", "review": { "status": "reviewed", "reviewedAt": "2026-09-11", "nextReviewAt": "2026-12-10" } },
    { "id": "microsoft-learn", "name": "Microsoft Learn", "owner": "Microsoft", "url": "https://learn.microsoft.com/training/", "access": "open-and-registration", "cost": "free", "languages": ["multiple"], "formats": ["online", "self-paced", "lab"], "offline": "unknown", "credentials": ["applied skill", "professional certification pathway"], "skills": ["artificial intelligence", "cloud", "data", "business applications", "software development"], "careers": ["technology", "data analysis", "business operations"], "geography": "global", "review": { "status": "reviewed", "reviewedAt": "2026-09-11", "nextReviewAt": "2026-12-10" } },
    { "id": "cisco-skills-for-all", "name": "Cisco Skills for All", "owner": "Cisco", "url": "https://skillsforall.com/", "access": "registration", "cost": "free", "languages": ["multiple"], "formats": ["online", "self-paced", "lab"], "offline": "unknown", "credentials": ["digital badge", "professional certification pathway"], "skills": ["cybersecurity", "networking", "python", "data science"], "careers": ["network technician", "cybersecurity technician", "software development"], "geography": "global", "review": { "status": "reviewed", "reviewedAt": "2026-09-11", "nextReviewAt": "2026-12-10" } },
    { "id": "salesforce-trailhead", "name": "Salesforce Trailhead", "owner": "Salesforce", "url": "https://trailhead.salesforce.com/", "access": "registration", "cost": "free", "languages": ["multiple"], "formats": ["online", "self-paced", "lab"], "offline": "mobile-app-limited", "credentials": ["badge", "superbadge", "professional certification pathway"], "skills": ["customer relationship management", "artificial intelligence", "data", "sales"], "careers": ["sales operations", "customer service", "system administration"], "geography": "global", "review": { "status": "reviewed", "reviewedAt": "2026-09-11", "nextReviewAt": "2026-12-10" } },
    { "id": "path-to-pro", "name": "Path to Pro", "owner": "The Home Depot", "url": "https://www.pathtopro.com/free-training/", "access": "registration", "cost": "free", "languages": ["en", "es"], "formats": ["online", "self-paced"], "offline": "unknown", "credentials": ["entry-level certificate"], "skills": ["construction", "electrical", "plumbing", "carpentry", "safety"], "careers": ["skilled trades", "construction"], "geography": "United States; availability restrictions may apply", "review": { "status": "reviewed", "reviewedAt": "2026-09-11", "nextReviewAt": "2026-12-10" } },
    { "id": "aleph-digital-ad-expert", "name": "Digital Ad Expert", "owner": "Aleph Group", "url": "https://learn.digitaladexpert.com/", "access": "registration", "cost": "free-scholarship", "languages": ["en", "es", "ar", "fr"], "formats": ["online", "self-paced", "virtual-live"], "offline": "unknown", "credentials": ["digital diploma"], "skills": ["digital advertising", "marketing", "data analysis", "professional development"], "careers": ["digital marketing", "advertising"], "geography": "global; learners must be age 16 or older", "review": { "status": "reviewed", "reviewedAt": "2026-09-11", "nextReviewAt": "2026-12-10" } },
    { "id": "openlearn-employability", "name": "OpenLearn Employability Hub", "owner": "The Open University", "url": "https://www.open.edu/openlearn/employability-hub", "access": "open-and-registration", "cost": "free", "languages": ["en"], "formats": ["online", "self-paced"], "offline": "downloadable-resources-vary", "credentials": ["statement of participation", "digital badge on selected courses"], "skills": ["communication", "teamwork", "leadership", "CV development", "inclusion"], "careers": ["all occupations", "management"], "geography": "global", "review": { "status": "reviewed", "reviewedAt": "2026-09-11", "nextReviewAt": "2026-12-10" } },
    { "id": "unicef-agora", "name": "UNICEF Agora", "owner": "UNICEF", "url": "https://agora.unicef.org/", "access": "registration", "cost": "free", "languages": ["multiple"], "formats": ["online", "mobile", "offline"], "offline": "supported", "credentials": ["certificate on selected activities", "digital badge on selected activities"], "skills": ["humanitarian work", "development", "leadership", "communication", "child rights"], "careers": ["development", "humanitarian services", "public service"], "geography": "global", "review": { "status": "reviewed", "reviewedAt": "2026-09-11", "nextReviewAt": "2026-12-10" } },
    { "id": "openwho", "name": "OpenWHO", "owner": "World Health Organization", "url": "https://openwho.org/", "access": "open", "cost": "free", "languages": ["multiple"], "formats": ["online", "low-bandwidth", "downloadable"], "offline": "downloadable-resources", "credentials": ["none-listed-at-catalog-level"], "skills": ["public health", "emergency response", "infection prevention", "health communication"], "careers": ["health support", "public health", "emergency services"], "geography": "global", "review": { "status": "reviewed", "reviewedAt": "2026-09-11", "nextReviewAt": "2026-12-10" } },
    { "id": "itcilo", "name": "International Training Centre of the ILO", "owner": "International Labour Organization", "url": "https://www.itcilo.org/courses", "access": "open-and-registration", "cost": "free-and-paid", "languages": ["multiple"], "formats": ["online", "self-paced", "mobile-first", "classroom", "blended"], "offline": "varies-by-course", "credentials": ["certificate on selected courses"], "skills": ["occupational safety", "labour rights", "management", "entrepreneurship", "cooperatives"], "careers": ["worker and employer services", "management", "public administration"], "geography": "global", "review": { "status": "reviewed", "reviewedAt": "2026-09-11", "nextReviewAt": "2026-12-10" } }
  ]
}
